[
  {
    "id": "atl-tf-the-club",
    "airport_code": "ATL",
    "airport_name": "Hartsfield-Jackson Atlanta International Airport",
    "city": "Atlanta",
    "country": "US",
    "terminal": "Concourse F, Mezzanine Level",
    "lounge_name": "The Club ATL",
    "network": "The Club",
    "waitlist_url": "https://waitwhile.com/locations/the-club-atl",
    "qr_code_only": false,
    "notes": "Priority Pass and day-pass accepted. Join Waitwhile queue when full.",
    "last_verified": "2026-08-14"
  },
  {
    "id": "bos-tc-the-lounge",
    "airport_code": "BOS",
    "airport_name": "Boston Logan International Airport",
    "city": "Boston",
    "country": "US",
    "terminal": "Terminal C, near Gate C19",
    "lounge_name": "The Lounge BOS (The Club)",
    "network": "The Club",
    "waitlist_url": "https://waitwhile.com/locations/the-club-bos",
    "qr_code_only": false,
    "notes": "Direct Waitwhile queue link for Terminal C lounge.",
    "last_verified": "2026-08-14"
  },
  {
    "id": "buf-tm-the-club",
    "airport_code": "BUF",
    "airport_name": "Buffalo Niagara International Airport",
    "city": "Buffalo",
    "country": "US",
    "terminal": "Main Terminal, between Gates 6 and 7",
    "lounge_name": "The Club BUF",
    "network": "The Club",
    "waitlist_url": "https://waitwhile.com/locations/the-club-buf",
    "qr_code_only": false,
    "notes": "Priority Pass accessible. Mobile queue via Waitwhile.",
    "last_verified": "2026-08-14"
  },
  {
    "id": "bwi-td-the-club",
    "airport_code": "BWI",
    "airport_name": "Baltimore/Washington International Thurgood Marshall Airport",
    "city": "Baltimore",
    "country": "US",
    "terminal": "Concourse D, near Gate D10",
    "lounge_name": "The Club BWI",
    "network": "The Club",
    "waitlist_url": "https://waitwhile.com/locations/the-club-bwi",
    "qr_code_only": false,
    "notes": "Priority Pass accepted. Join digital line via Waitwhile.",
    "last_verified": "2026-08-14"
  },
  {
    "id": "chs-tm-the-club",
    "airport_code": "CHS",
    "airport_name": "Charleston International Airport",
    "city": "Charleston",
    "country": "US",
    "terminal": "Main Terminal, 2nd Floor towards Concourse B",
    "lounge_name": "The Club CHS",
    "network": "The Club",
    "waitlist_url": "https://waitwhile.com/locations/the-club-chs",
    "qr_code_only": false,
    "notes": "Accessible to all ticketed passengers post-security.",
    "last_verified": "2026-08-14"
  },
  {
    "id": "cle-tb-the-club",
    "airport_code": "CLE",
    "airport_name": "Cleveland Hopkins International Airport",
    "city": "Cleveland",
    "country": "US",
    "terminal": "Concourse B, immediately after security",
    "lounge_name": "The Club CLE",
    "network": "The Club",
    "waitlist_url": "https://waitwhile.com/locations/the-club-cle",
    "qr_code_only": false,
    "notes": "Digital Waitwhile waitlist active during peak bank departures.",
    "last_verified": "2026-08-14"
  },
  {
    "id": "clt-ta-the-club",
    "airport_code": "CLT",
    "airport_name": "Charlotte Douglas International Airport",
    "city": "Charlotte",
    "country": "US",
    "terminal": "Concourse A Expansion, between Gates A21 and A22",
    "lounge_name": "The Club CLT",
    "network": "The Club",
    "waitlist_url": "https://waitwhile.com/locations/the-club-clt",
    "qr_code_only": false,
    "notes": "Two-story lounge in Concourse A expansion. Priority Pass accepted.",
    "last_verified": "2026-08-14"
  },
  {
    "id": "cvg-ta-the-club",
    "airport_code": "CVG",
    "airport_name": "Cincinnati/Northern Kentucky International Airport",
    "city": "Cincinnati",
    "country": "US",
    "terminal": "Concourse A, between Gates A8 and A10",
    "lounge_name": "The Club CVG",
    "network": "The Club",
    "waitlist_url": "https://waitwhile.com/locations/the-club-cvg",
    "qr_code_only": false,
    "notes": "Waitwhile queue available when lounge reaches capacity.",
    "last_verified": "2026-08-14"
  },
  {
    "id": "dfw-td-the-club",
    "airport_code": "DFW",
    "airport_name": "Dallas/Fort Worth International Airport",
    "city": "Dallas-Fort Worth",
    "country": "US",
    "terminal": "Terminal D, near Gate D27",
    "lounge_name": "The Club DFW",
    "network": "The Club",
    "waitlist_url": "https://waitwhile.com/locations/the-club-dfw",
    "qr_code_only": false,
    "notes": "Accessible from all terminals via Skylink train.",
    "last_verified": "2026-08-14"
  },
  {
    "id": "grr-ta-the-club",
    "airport_code": "GRR",
    "airport_name": "Gerald R. Ford International Airport",
    "city": "Grand Rapids",
    "country": "US",
    "terminal": "Concourse A, near Gate A6",
    "lounge_name": "The Club GRR",
    "network": "The Club",
    "waitlist_url": "https://waitwhile.com/locations/the-club-grr",
    "qr_code_only": false,
    "notes": "Waitwhile queue for post-security lounge in Concourse A.",
    "last_verified": "2026-08-14"
  },
  {
    "id": "jfk-t4-chase-sapphire-lounge",
    "airport_code": "JFK",
    "airport_name": "John F. Kennedy International Airport",
    "city": "New York",
    "country": "US",
    "terminal": "Terminal 4, post-security, near Gate A2",
    "lounge_name": "Chase Sapphire Lounge by The Club with Etihad Airways",
    "network": "Chase Sapphire Lounge",
    "waitlist_url": "https://chasesapphirelounge.theclubexperience.com",
    "qr_code_only": false,
    "notes": "Digital waitlist active during peak hours.",
    "last_verified": "2026-08-14"
  },
  {
    "id": "jfk-t4-delta-sky-club",
    "airport_code": "JFK",
    "airport_name": "John F. Kennedy International Airport",
    "city": "New York",
    "country": "US",
    "terminal": "Terminal 4, Concourse B, near Gate B32",
    "lounge_name": "Delta Sky Club",
    "network": "Delta Sky Club",
    "waitlist_url": "https://www.delta.com/us/en/delta-sky-club/overview",
    "qr_code_only": false,
    "notes": "Features Sky Deck. Waitlist queue on the Fly Delta app when lounge reaches capacity.",
    "last_verified": "2026-08-14"
  },
  {
    "id": "las-t3-the-club",
    "airport_code": "LAS",
    "airport_name": "Harry Reid International Airport",
    "city": "Las Vegas",
    "country": "US",
    "terminal": "Terminal 3, across from Gate E2",
    "lounge_name": "The Club LAS (Terminal 3)",
    "network": "The Club",
    "waitlist_url": "https://waitwhile.com/locations/the-club-las-t3",
    "qr_code_only": false,
    "notes": "Direct Waitwhile queue for Terminal 3.",
    "last_verified": "2026-08-14"
  },
  {
    "id": "las-td-amex-centurion",
    "airport_code": "LAS",
    "airport_name": "Harry Reid International Airport",
    "city": "Las Vegas",
    "country": "US",
    "terminal": "Concourse D, opposite Gate D1",
    "lounge_name": "The Centurion Lounge",
    "network": "American Express Centurion",
    "waitlist_url": "https://global.americanexpress.com/lounge-access/the-centurion-lounge",
    "qr_code_only": false,
    "notes": "Accessible from all terminals via the automated transit system.",
    "last_verified": "2026-08-14"
  },
  {
    "id": "las-td-the-club",
    "airport_code": "LAS",
    "airport_name": "Harry Reid International Airport",
    "city": "Las Vegas",
    "country": "US",
    "terminal": "Terminal 1, Concourse D, 2nd floor near Gate D33",
    "lounge_name": "The Club LAS (Terminal 1D)",
    "network": "The Club",
    "waitlist_url": "https://waitwhile.com/locations/the-club-las-t1",
    "qr_code_only": false,
    "notes": "Direct Waitwhile queue for Terminal 1 Concourse D.",
    "last_verified": "2026-08-14"
  },
  {
    "id": "lax-tb-amex-centurion",
    "airport_code": "LAX",
    "airport_name": "Los Angeles International Airport",
    "city": "Los Angeles",
    "country": "US",
    "terminal": "Tom Bradley International Terminal (TBIT)",
    "lounge_name": "The Centurion Lounge",
    "network": "American Express Centurion",
    "waitlist_url": "https://global.americanexpress.com/lounge-access/the-centurion-lounge",
    "qr_code_only": false,
    "notes": "Connected airside to Terminals 4, 5, 6, 7, and 8.",
    "last_verified": "2026-08-14"
  },
  {
    "id": "mco-ta-the-club",
    "airport_code": "MCO",
    "airport_name": "Orlando International Airport",
    "city": "Orlando",
    "country": "US",
    "terminal": "Terminal A, Concourse 1, near Gate 29",
    "lounge_name": "The Club MCO (Terminal A)",
    "network": "The Club",
    "waitlist_url": "https://waitwhile.com/locations/the-club-mco-a1",
    "qr_code_only": false,
    "notes": "Direct Waitwhile queue link for Terminal A Concourse 1.",
    "last_verified": "2026-08-14"
  },
  {
    "id": "mco-tb-the-club",
    "airport_code": "MCO",
    "airport_name": "Orlando International Airport",
    "city": "Orlando",
    "country": "US",
    "terminal": "Terminal B, Concourse 4, near Gate 91",
    "lounge_name": "The Club MCO (Terminal B)",
    "network": "The Club",
    "waitlist_url": "https://waitwhile.com/locations/the-club-mco-a4",
    "qr_code_only": false,
    "notes": "Direct Waitwhile queue link for Terminal B Concourse 4.",
    "last_verified": "2026-08-14"
  },
  {
    "id": "mdw-tc-the-club",
    "airport_code": "MDW",
    "airport_name": "Chicago Midway International Airport",
    "city": "Chicago",
    "country": "US",
    "terminal": "Central Market, near Gate A1",
    "lounge_name": "The Club MDW",
    "network": "The Club",
    "waitlist_url": "https://waitwhile.com/locations/the-club-mdw",
    "qr_code_only": false,
    "notes": "First lounge at MDW. Priority Pass and day passes accepted via Waitwhile queue.",
    "last_verified": "2026-08-14"
  },
  {
    "id": "msy-ta-the-club",
    "airport_code": "MSY",
    "airport_name": "Louis Armstrong New Orleans International Airport",
    "city": "New Orleans",
    "country": "US",
    "terminal": "Concourse A, 3rd floor across from Gate A1",
    "lounge_name": "The Club MSY",
    "network": "The Club",